{
  "$schema": "https://json-schema.org/draft/2020-12/schema",
  "$id": "https://acsd.local/schemas/unified/frame_snr/v1",
  "title": "ACSD 统一对象 frame_snr —— 帧级信噪比（不是权重）",
  "description": "UNIFIED_MODEL §2：frame_snr = 帧级 SNR（信噪比，非权重）：真实信号/噪声比，不受天光影响；可否作权重 = 唯一帧级参考；权重由 Phase2 逆方差叠加从 SNR 计算。frame_snr 本身不是权重，也不是 depth_m5（5σ 深度），二者不得互填。",
  "x-acsd-object": {
    "name": "frame_snr",
    "canonical_file": "eng/contracts/schemas/unified/frame_snr.schema.json",
    "authority": "docs/detail/UNIFIED_MODEL.md §2；docs/ACSD_DESIGN.md §2；ENGINEERING_SPEC.md §3/§4.7",
    "weight_verdict": "唯一帧级参考；权重由 Phase2 逆方差叠加从 SNR 计算",
    "weight_eligible": false
  },
  "type": "object",
  "additionalProperties": false,
  "required": [
    "unified_object",
    "object_schema_id",
    "schema_version",
    "units",
    "missing_value",
    "precision",
    "object_weight_capability",
    "object_weight_verdict",
    "provenance",
    "frame_snr_value",
    "frame_id",
    "estimator",
    "role"
  ],
  "propertyNames": {
    "pattern": "^(?!(weight|value|mask|snr)$)(?!(weight|value|mask|snr)(_|$))(?!(weight|value|mask)(_|$)).*$",
    "not": {
      "enum": [
        "ivar",
        "inverse_variance",
        "variance",
        "var",
        "sigma",
        "sigma2",
        "fisher",
        "fisher_information",
        "information",
        "w_info",
        "w_psf",
        "snr",
        "snr2",
        "support",
        "coverage"
      ],
      "description": "禁止键守卫（FZ-FIELD-PSFSW-4COMP / FZ-GATE-PSFSW-COV）：诊断量/派生量不得作为裸键出现，禁止写成 ivar/Fisher/W_info/方差/SNR/support/coverage 等；判据见 docs/engineering/UNIFIED_OBJECTS.md「归属归一与产品族字段级约束落点」一节登记的 psfsw 记录类字段级约束"
    }
  },
  "properties": {
    "unified_object": {
      "const": "frame_snr",
      "description": "对象判别式：本文档声明的 UNIFIED_MODEL §2 对象名（禁止用别的对象名冒充）"
    },
    "object_schema_id": {
      "const": "https://acsd.local/schemas/unified/frame_snr/v1",
      "description": "全局唯一 schema ID（eng/contracts/schemas/unified/frame_snr.schema.json）"
    },
    "schema_version": {
      "const": 1
    },
    "units": {
      "type": "object",
      "additionalProperties": false,
      "required": [
        "bunit",
        "bunit_semantics",
        "pixel_semantics",
        "pixel_area_power"
      ],
      "propertyNames": {
        "pattern": "^(?!(weight|value|mask|snr|snr_value|weight_value|value_value|mask_value)$).*$"
      },
      "properties": {
        "bunit": {
          "description": "FITS BUNIT 写盘串（量纲必须可判：含立体角幂次，或由 bunit_semantics 显式声明）",
          "type": "string",
          "minLength": 1,
          "maxLength": 64,
          "pattern": "^[A-Za-z0-9][A-Za-z0-9_^/(). -]*$"
        },
        "bunit_semantics": {
          "description": "FZ-BUNIT-SEMANTICS：written_px_power = BUNIT 显式含立体角幂次（canonical \"sr\"）；declared_via_provenance = BUNIT 仅写 ADU 时必须由 provenance 声明 pixel_semantics + pixel_area_power",
          "enum": [
            "written_px_power",
            "declared_via_provenance"
          ]
        },
        "pixel_semantics": {
          "description": "像素语义（BUNIT=ADU 时唯一可判依据）",
          "enum": [
            "surface_brightness",
            "integrated_flux",
            "dimensionless",
            "count",
            "probability",
            "magnitude"
          ]
        },
        "pixel_area_power": {
          "description": "立体角幂次：面亮度 -2 / 通量 0（FZ-BUNIT-SEMANTICS 缺省表；-2 ⇔ canonical 串含 /sr）",
          "enum": [
            -2,
            0
          ]
        },
        "target_pixel_area": {
          "description": "目标像素面积（BUNIT=ADU 且 surface_brightness 时必需）",
          "type": "number",
          "exclusiveMinimum": 0
        }
      },
      "allOf": [
        {
          "if": {
            "properties": {
              "bunit": {
                "pattern": "/sr"
              }
            },
            "required": [
              "bunit"
            ]
          },
          "then": {
            "properties": {
              "bunit_semantics": {
                "const": "written_px_power"
              },
              "pixel_semantics": {
                "const": "surface_brightness"
              },
              "pixel_area_power": {
                "const": -2
              }
            }
          }
        },
        {
          "if": {
            "properties": {
              "bunit_semantics": {
                "const": "declared_via_provenance"
              }
            },
            "required": [
              "bunit_semantics"
            ]
          },
          "then": {
            "required": [
              "target_pixel_area"
            ],
            "properties": {
              "pixel_semantics": {
                "const": "surface_brightness"
              },
              "pixel_area_power": {
                "const": -2
              }
            }
          }
        },
        {
          "if": {
            "properties": {
              "pixel_semantics": {
                "const": "integrated_flux"
              }
            },
            "required": [
              "pixel_semantics"
            ]
          },
          "then": {
            "properties": {
              "pixel_area_power": {
                "const": 0
              }
            }
          }
        }
      ]
    },
    "missing_value": {
      "type": "object",
      "additionalProperties": false,
      "required": [
        "missing_repr",
        "invalid_repr"
      ],
      "propertyNames": {
        "pattern": "^(?!(weight|value|mask|snr|snr_value|weight_value|value_value|mask_value)$).*$"
      },
      "properties": {
        "missing_repr": {
          "description": "缺失表示（对象文档不得省略该声明）",
          "enum": [
            "null",
            "absent_key",
            "zero",
            "null_or_absent",
            "unavailable_object"
          ]
        },
        "invalid_repr": {
          "description": "无效值表示",
          "enum": [
            "null",
            "nan",
            "zero",
            "nan_or_negative",
            "mask_bit",
            "unavailable_object",
            "not_applicable"
          ]
        },
        "nan_in_binary": {
          "description": "二进制平面是否允许 NaN 承载 invalid（JSON 无 NaN 字面量）",
          "type": "boolean"
        },
        "silent_zero_forbidden": {
          "description": "禁止用 0 冒充缺失/不可用（静默 0 = fail-closed）",
          "type": "boolean"
        },
        "sentinel_note": {
          "description": "补充说明（不得引入第二套无效值口径）",
          "type": "string",
          "minLength": 1
        }
      }
    },
    "precision": {
      "description": "精度：float32 / float64 / integer（与 `docs/science/unified/DATA_SEMANTICS.md`「精度」一节 一致，不得自定第二套）",
      "enum": [
        "float32",
        "float64",
        "integer"
      ]
    },
    "object_weight_capability": {
      "const": false,
      "description": "UNIFIED_MODEL §2「可否作权重」列的机器判定（照抄，不得自行改判定）"
    },
    "object_weight_verdict": {
      "const": "唯一帧级参考；权重由 Phase2 逆方差叠加从 SNR 计算",
      "description": "UNIFIED_MODEL §2「可否作权重」列原文（逐字）"
    },
    "provenance": {
      "type": "object",
      "additionalProperties": false,
      "required": [
        "source_chain"
      ],
      "propertyNames": {
        "pattern": "^(?!(weight|value|mask|snr|snr_value|weight_value|value_value|mask_value)$).*$"
      },
      "properties": {
        "source_chain": {
          "type": "array",
          "minItems": 1,
          "uniqueItems": true,
          "items": {
            "description": "上游产品/输入标识（产物引用，悬空即 REJECT）",
            "type": "string",
            "minLength": 1
          },
          "description": "来源链：本对象由哪些上游产物/输入派生（FZ-PROV-MINIMAL-SET 的对象级最小集）"
        },
        "software_sha": {
          "description": "生成该对象的软件完整 SHA（40 hex）",
          "type": "string",
          "pattern": "^[0-9a-f]{40}$"
        },
        "config_hash": {
          "description": "配置哈希（run_manifest.config_hash）",
          "type": "string",
          "minLength": 1
        },
        "algorithm_ids": {
          "type": "array",
          "minItems": 1,
          "uniqueItems": true,
          "items": {
            "description": "算法条款 ID（ALG-* / SCI-*）",
            "type": "string",
            "minLength": 1
          }
        },
        "generated_utc": {
          "description": "生成时间 UTC（ISO-8601，Z 结尾）",
          "type": "string",
          "pattern": "^[0-9]{4}-[0-9]{2}-[0-9]{2}T[0-9]{2}:[0-9]{2}:[0-9]{2}Z$"
        }
      }
    },
    "frame_snr_value": {
      "description": "帧级信噪比 = 真实信号/噪声（无量纲；不受天光影响）",
      "type": "number",
      "minimum": 0
    },
    "frame_id": {
      "description": "帧标识",
      "type": "string",
      "minLength": 1
    },
    "estimator": {
      "description": "估计器标识（版本化）",
      "type": "string",
      "minLength": 1
    },
    "role": {
      "description": "角色：唯一帧级参考（非权重）",
      "enum": [
        "unique_frame_reference"
      ]
    },
    "reference_baseline": {
      "description": "FREF-BASELINE-001：帧级 SNR 的**参考通量基准**。SNR_k(F_ref) = F_ref/σ_F,k 只有在参考通量统一时帧间才可比（GAP_AUDIT §9.49 定案 7）。本对象声明该基准的取法与其公共锚，使「帧级 SNR × 稀疏权重」有共同尺度。",
      "type": "object",
      "additionalProperties": false,
      "required": [
        "scope",
        "reference_flux_source",
        "reference_flux_common",
        "reference_mag",
        "reference_mag_system"
      ],
      "properties": {
        "scope": {
          "description": "参考通量的作用域。group = 块级公共 F0（reference_flux_common 为 ADU 常数）; frame_independent_fixed_magnitude = 固定参考星等 m_ref 在本帧的仪器通量 F_ref,k = 10^(-0.4*(m_ref-ZP_k))（逐帧、只依赖本帧标定，无「组」概念）。两种作用域下 reference_flux_common 都必须是**物理公共锚**且对同波段同星场恒为同一数。",
          "enum": [
            "group",
            "frame_independent_fixed_magnitude"
          ]
        },
        "reference_flux_source": {
          "description": "参考通量的来源判据（机器可读）。fixed_magnitude = 由固定参考星等 + 本帧测光零点导出; group_median = 块级检出通量中位数（数据派生，帧间不独立）; config = 显式配置; unavailable = 不可得（该帧 fail-closed，不写帧级 SNR 键）",
          "enum": [
            "fixed_magnitude",
            "group_median",
            "config",
            "unavailable"
          ]
        },
        "reference_flux_common": {
          "description": "**物理公共锚** F0（配对性定理的 F_ref）。fixed_magnitude 作用域下 = 10^(-0.4*(m_ref-C_abs))，`C_abs` 是固定的通带常数（把绝对通量换成星等的约定常数，作为常数使用时不随星族/天区变化，取值取自文档化的参考域）⇒ 跨帧恒等；它与完全锚定在 Gaia G 绝对通量刻度上的“纯通带常数”相差参考域样本的中位合成颜色（该量尚未测定 ⇒ 当前系统的绝对刻度锚定在参考域；该差值为常数，只影响 m5 的绝对数值）。定义正本 = docs/science/noise_snr/NOISE_SNR.md 的「绝对信噪比」一节；参考域/参考通带与取值、不确定度 = docs/detail/registry/acsd.phase1.photometry.md 的「正确的仪器零点式」一节。相位 2 的公共通量闸门（ACSD_REFERENCE_FLUX 组内一致，相对容差 1e-9）读此值。禁止用它反推增益/口径/曝光。",
          "type": "number",
          "exclusiveMinimum": 0
        },
        "reference_flux_common_unit": {
          "description": "reference_flux_common 的单位口径。F_syn (Gaia XPSD absolute spectral integral) = 与 F_instr 同标度的合成通量单位（ADU 等价），非物理 W/m^2。",
          "type": "string",
          "minLength": 1
        },
        "reference_mag": {
          "description": "固定参考星等 m_ref（星等制见 reference_mag_system）。必须随产品落盘：SNR 数值只有配上 m_ref 才有物理含义。注意 m_ref 是**参考电平**，不是「本帧能测到的星」—— 亮端外推（如 m_ref=6 对深窄带数据）仍是良定义，但不得解释为可探测星。",
          "type": "number"
        },
        "reference_mag_system": {
          "description": "m_ref 所属星等制。gaia_g_via_synthetic_xpsd = Gaia G 星等，通量由 Gaia DR3 XP 绝对谱 + 本帧滤光片/QE 正向合成（与 k_photo 同一 F_syn 口径，无物理闭合反推）",
          "enum": [
            "gaia_g_via_synthetic_xpsd"
          ]
        },
        "reference_zero_point_syn_mag": {
          "description": "绝对刻度零点（键名沿用旧名，现承载固定通带常数，不再是逐天区合成零点）：`C_abs` [mag]，是固定通带常数，作为常数使用时不随星族/天区变化、与帧无关；取值取自文档化的参考域，与完全锚定在 Gaia G 绝对通量刻度上的“纯通带常数”相差参考域样本的中位合成颜色（该量尚未测定，故当前系统的绝对刻度锚定在参考域）。定义正本 = docs/science/noise_snr/NOISE_SNR.md 的「绝对信噪比」一节。",
          "type": "number"
        },
        "frame_zero_point_mag": {
          "description": "本帧测光零点 ZP_k = C_abs - 2.5*log10(k_photo,k) [mag]（`C_abs` = 固定通带常数，作为常数使用时不随星族/天区变化，取值取自文档化的参考域），满足 mag = ZP_k - 2.5*log10(F_adu)。F_ref,k = 10^(-0.4*(m_ref-ZP_k))。",
          "type": "number"
        },
        "frame_k_photo": {
          "description": "本帧测光标度 k_photo（I_photo = k_photo·I_cal）。帧间不同是正常的（不同夜透明度本就不一样，GAP_AUDIT §9.49 定案 2）。",
          "type": "number",
          "exclusiveMinimum": 0
        },
        "pairing_identity": {
          "description": "配对性核对式（WEIGHT-SCI-001）：帧级 SNR 的分子参考通量必须与换算权重用的公共锚配对 —— w = SNR_k²/F0² = a_k²/σ_k²。本字段记录该恒等式的机器可读形式。",
          "type": "string",
          "minLength": 1
        }
      }
    }
  }
}
